,title,company,rating,search_city,location,salary,age,summary
565,Front End Engineer,Omics Data Automation Inc,,Portland,"Portland, OR",,30+ days ago,"Omics Data Automation, Inc. (ODA) develops infrastructure for aggregating multidimensional data to enable customers to scale their data analytics."
566,Transportation Planning & Analysis Associate,DKS Associates,3.6,Portland,"Portland, OR 97205",,30+ days ago,"This position will lead the planning analysis tasks of various transportation planning projects that may involve traffic analysis, multimodal corridor studies,…"
567,"Splunk Engineer/Architect-Portland, OR",iSenpai,4.7,Portland,"Portland, OR 97201",,30+ days ago,"Experience working with other big data analytics solutions (Elastic Stack, Palantir, HP ArcSight, etc.) is a plus.Life Insurance provided by iSenpai."
568,Enterprise Account Executive - Portland,Sumo Logic,4.0,Portland,"Portland, OR",,30+ days ago,"Democratize machine data analytics through the Sumo Logic platform, bringing real-time data insights securely through the cloud."
569,SKILLBRIDGE INTERNSHIP FOR ACTIVE DUTY SERVICE MEMBERS,Tilson Technology Management,3.1,Portland,"Portland, OR",,30+ days ago,SKILLBRIDGE INTERNSHIP FOR ACTIVE DUTY SERVICE MEMBERS.Tilson is a high growth team of driven professionals with a national practice.
570,"Software Engineer, Machine Learning/Automation Intern",New Relic,3.0,Portland,"Portland, OR 97204",,10 days ago,"Look for opportunities to use modern software techniques, like Machine Learning, and vendor solutions to transform the support experience."
571,Machine Learning / Data Scientist Engineer,Ampere Computing,,Portland,"Portland, OR",,30+ days ago,"Experience and knowledge in machine learning.Design new models and machine learning algorithms, such as supervised and unsupervised learning, deep learning,…"
572,Office Admin,Frontdoor,,Portland,"Portland, OR 97240 (Hosford area)",,18 days ago,"They can also take remote measurements, because Streem is capturing depth information during the call.Provides administrative and staff support services to the…"
573,ASSOCIATE DATA SCIENTIST,Nike,4.2,Portland,"Portland, OR",,12 days ago,Collaborate with other data scientists to explore opportunities to develop and utilize statistical modeling and machine learning algorithms to support…
574,Data Analytics and Machine Learning Solutions Architect,Nike,4.2,Portland,"Beaverton, OR",,17 days ago,"Will design and implement system and application solutions to meet business needs, and to provide ongoing expert support of existing systems and applications in…"
575,Customer Success Manager,Frontdoor,,Portland,"Portland, OR 97240 (Hosford area)",,14 days ago,"They can also take remote measurements, because Streem is capturing depth information during the call.We’re looking for a customer success superstar who can…"
576,3D Data Scientist Internship,HP,4.0,Portland,"Vancouver, WA 98683 (Bella Vista area)",,7 days ago,"We expect you to be an accomplished machine learning specialist, in particular, you must have at least one of following experiences."
577,Tableau Developer,Avani Technology Solutions Inc,4.6,Portland,"Portland, OR",,12 days ago,"Experience integrating advanced analytics (machine learning, predictive analytics, etc.) capabilities into solutions a plus."
578,IP Characterization - Spring 2020 Intern,Synopsys,4.1,Portland,"Hillsboro, OR 97124",,30+ days ago,"Machine learning and computer vision.To accelerate prototyping, software development and integration of IP into SoCs, Synopsys' IP Accelerated initiative…"
579,Student Intern 3 - Engineering (June - August 2020),Skyworks,3.9,Portland,"Beaverton, OR",,27 days ago,Testing and evaluating DSP and machine learning algorithms.Minimum education: BS or MS with focus on signal processing and/or machine learning.
580,"Director Data Science, Personalization / Activity",Nike,4.2,Portland,"Portland, OR",,30+ days ago,"Nike is looking for a Director of Activity Personalization Science.This leader, in partnership with product and engineering teams, is responsible for…"
581,Global Technology Internship,Nike,4.2,Portland,"Beaverton, OR",,30+ days ago,They also provide the business with the tools and services needed to do each job effectively from sales and design to advertising and distribution.
582,"Intern, Software Engineering (2020)",Ampere Computing,,Portland,"Portland, OR",,30+ days ago,"Like the scientist behind its name, Ampere employees are innovators.We understand the needs of cloud computing and different software requirements."
583,Summer Engineering Intern,Tektronix,3.7,Portland,"Beaverton, OR 97005 (Central Beaverton area)",,30+ days ago,Each intern reports up to a project manager and also receives a mentor to guide them through their experience.Other skills and interests we look for are:
584,Associate Data Analyst,Vesta Corporation,3.2,Portland,"Lake Oswego, OR 97035",,30+ days ago,POSITION SUMMARY: Vesta Corporation is seeking a highly analytical individual to join our eCommerce Risk Operations team as a Data Analyst.
585,"CPU Design Verification Engineer, Entry level",Ampere Computing,,Portland,"Portland, OR",,5 days ago,"Like the scientist behind its name, Ampere employees are innovators.We understand the needs of cloud computing and different software requirements."
586,Account Manager,Maya Heat Transfer Technologies,,Portland,"Portland, OR",,14 days ago,"In addition to developing software, and as a strategic development partner and software reseller for Siemens PLM Software, MAYA also specializes in providing…"
587,Data Integration Developer,Rose Quarter,4.4,Portland,"Portland, OR",,21 days ago,"As our Data Integration Developer, you will be responsible for designing, developing, testing, implementing, and maintaining business critical data integrations…"
588,"Vice President, Product - Advertising Technology",Zalando,,Portland,"Portland, OR",,4 days ago,"**THIS OPPORTUNITY REQUIRES RELOCATION TO BERLIN, GERMANY***.Zalando Marketing Services (ZMS) is the 360° marketing unit of Zalando."
589,Junior Developer - Robotics and Internal Tools,Quantum Spatial INC,3.3,Portland,"Portland, OR 97204",,10 days ago,Works under the guidance of Senior Engineers to implement and troubleshoot complex solutions for a wide array of geospatial applications.
590,Senior Data Scientist,Kinsa Inc.,,Portland,"Portland, OR",,30+ days ago,"The ideal candidate is skilled in a range of general data science, machine learning and other statistical approaches; has the engineering experience to build…"
591,Account Manager,Maya Heat Transfer Technologies,,Portland,"Portland, OR",,14 days ago,"In addition to developing software, and as a strategic development partner and software reseller for Siemens PLM Software, MAYA also specializes in providing…"
592,Staff Software Engineer - Bioinformatics Algorithms & Machin...,BD,3.8,Portland,"Portland, OR",,30+ days ago,"Demonstrable expertise in artificial intelligence and machine learning.Knowledge of Python, R, MATLAB, Scala or another programming language commonly used in…"
593,Data Engineering Intern - Summer 2020,"Cylance, Inc.",3.5,Portland,"Portland, OR 97204 (Downtown area)",,6 days ago,"Projects, coursework, or experience related to machine learning.We build tools and systems that transform data, train machine learning models, and deliver…"
594,Research Associate (Research Statistician),Oregon Health & Science University,4.0,Portland,"Portland, OR 97239 (Homestead area)","$41,812 a year",30+ days ago,"Knowledge of neural network and other machine learning techniques.Areas of research interest include clinical study design, control of data quality and…"
595,"Director, Recommendation Data Science",Nike,4.2,Portland,"Portland, OR",,12 days ago,"Expert knowledge in machine learning, particularly in ranking and deep learning models.The personalization science teams at Nike work on the machine learning…"
596,"Manager, Computer Vision/Machine Learning Engineering",Logitech,4.0,Portland,"Camas, WA 98607",,17 days ago,"Experience in machine learning or deep learning model training.3+ years experience in Machine Learning technologies and tools, such as training framework and…"
597,"Director, Program Management",Ampere Computing,,Portland,"Portland, OR",,30+ days ago,"Like the scientist behind its name, Ampere employees are innovators.We understand the needs of cloud computing and different software requirements."
598,Consultant,RHONDOS,,Portland,"Washougal, WA 98671","$120,000 - $180,000 a year",30+ days ago,RHONDOS is seeking full-time Splunk Consultants willing to travel between 50% and 90% of the time in support of key customer implementations.
599,Regional Launch Manager,"Amazon Web Services, Inc.",3.6,Portland,"Portland, OR",,30+ days ago,Bachelor’s Degree from an accredited institution.5+ years of experience providing regulatory support for product compliance or similar regulatory matters.
600,Sensor Algorithm Engineering Internship,Nike,4.2,Portland,"Beaverton, OR",,30+ days ago,"Use techniques from signal processing, pattern recognition, sensor fusion, time-series analysis, machine learning, and other areas of machine intelligence to…"
601,Taliesin Namkai-Meche Memorial Internship (Quantitative Anal...,"The Cadmus Group, Inc.",,Portland,"Portland, OR 97205 (Northwest area)",,7 days ago,"The Taliesin Namkai-Meche Memorial Internship was established by Cadmus to honor our friend and colleague, Taliesin.This is a paid, 40 hours/week internship."
602,Entry-Level Model Risk Analyst,Umpqua Bank,3.5,Portland,"Portland, OR 97258 (Downtown area)",,30+ days ago,"Advanced understanding of statistical modeling, econometric forecasting, machine learning, data extraction and processing techniques; and demonstrated ability…"
603,Nike App Analytics Manager,Nike,4.2,Portland,"Portland, OR",,30+ days ago,Core mathematical ability to understand and apply state-of-the-art machine learning algorithms and/or statistical modeling in a programming language like R or…
604,"Sr Dir, Foundry Ops",Lattice Semiconductor Corp,3.6,Portland,"Hillsboro, OR 97124",,30+ days ago,Potential opportunity to develop advanced diagnostics capability and Machine Learning algorithms for advanced outlier detection and elimination.
605,Business Intelligence Architect - Corporate,Hanna Andersson,3.6,Portland,"Portland, OR 97232 (Kerns area)",,20 days ago,"In addition, they will strive to utilize new technologies related to artificial intelligence, machine learning and predictive analytics that will enhance Hanna…"
606,Sr. Developer - Robotics and Change Detection,Quantum Spatial INC,3.3,Portland,"Portland, OR 97204",,10 days ago,Lead efforts related to machine learning applications from autonomous and distributed derived data systems.Demonstrated experience working with one or more of…
607,Formal Verification Research Intern,Intel,4.1,Portland,"Hillsboro, OR 97124",,30+ days ago,"Research domain-specific applications such as machine learning, security, etc.Responsibilities may be diverse of a technical nature."
608,Technical Sales Operations Specialist,Oath Inc,3.8,Portland,"Hillsboro, OR",,30+ days ago,"The SOS team provides first line technical support for internal users of Verizon Media’s Ad Platforms.We review, investigate, replicate, prioritize and resolve…"
609,Data Engineering Manager,Nike,4.2,Portland,"Beaverton, OR",,5 days ago,We are seeking a high performing Data Engineering Manager to play a critical role in the development of Nike’s Enterprise Data & Analytics capabilities.
610,Cryptographer,Intel,4.1,Portland,"Hillsboro, OR 97124",,30+ days ago,"Initiates the design, development, execution and implementation of scientific research projects to fuel Intel's growth in the areas of computing, communication,…"
611,"Intern, Logic and Microarchitecture (2020)",Ampere Computing,,Portland,"Portland, OR",,30+ days ago,"Like the scientist behind its name, Ampere employees are innovators.We understand the needs of cloud computing and different software requirements."
612,HE/PQC Cryptographer,Intel,4.1,Portland,"Hillsboro, OR 97124",,30+ days ago,"Initiates the design, development, execution and implementation of scientific research projects to fuel Intel's growth in the areas of computing, communication,…"
613,Research Architect - Program Analysis,"Cylance, Inc.",3.5,Portland,"Portland, OR 97204 (Downtown area)",,19 days ago,"As an architect, your main responsibilities will be to create and maintain Cylance’s proprietary binary analysis tools and platform to further improve our…"
614,Assistant Professor,Portland State University,4.2,Portland,"Portland, OR",,12 days ago,For more information please Click Here.The Fariborz Maseeh Department of Mathematics and Statistics at Portland State University seeks a tenure-track faculty…
615,Sales Engineer,Moogsoft,,Portland,"Portland, OR",,30+ days ago,"As a Sales Engineer at Moogsoft, you’ll serve as a key member of our Sales Team.You will be engaging with IT Operations Leaders (Application, Infrastructure,…"
616,"Yield Analysis Engineer, Senior Staff",Ampere Computing,,Portland,"Portland, OR",,4 days ago,"Like the scientist behind its name, Ampere employees are innovators.We understand the needs of cloud computing and different software requirements."
617,Software Engineer,Intel,4.1,Portland,"Hillsboro, OR 97124",,30+ days ago,Come and join Intel's Flex Solutions team as a Software Engineer.Flex Solutions is an internal consulting group supporting Intel's product group with software…
618,Assistant Professor,Oregon Health & Science University,4.0,Portland,"Portland, OR 97239 (Homestead area)",,30+ days ago,"Oregon Health & Science University (OHSU), located in Portland, OR is seeking exceptional Assistant Professor tenure-track faculty candidates with focus on…"
619,Senior Data Scientist,Nike,4.2,Portland,"Beaverton, OR",,30+ days ago,"We are the ML/AI experts responsible for dynamically personalizing content experiences.We want someone who loves modeling and writing code, and is excited…"
620,Director of Transaction Monitoring,Umpqua Bank,3.5,Portland,"Tigard, OR 97223",,30+ days ago,Responsible for overseeing all day to day AML Investigations activities.Looking for an innovative Director who is seasoned in implementing and maintaining a…
621,Director of Customer Analytics,Umpqua Bank,3.5,Portland,"Portland, OR 97209 (Pearl District area)",,30+ days ago,"In this role, you will provide customer analytics and insight to executive management, Lines of Business, and key functional areas to support revenue growth and…"
622,"Sr. Data Scientist, Flagship Digital",Nike,4.2,Portland,"Portland, OR",,30+ days ago,This role will utilize contemporary data science and analytics techniques embedded within the digital product teams to identify opportunities in our current…
623,Director Engineering AI & ML Platforms,Nike,4.2,Portland,"Portland, OR",,30+ days ago,"Build and grow a highly skilled, cross-functional engineering teams that deliver platforms enabling Nike’s Digital Transformation.WHAT YOU BRING TO NIKE."
624,Postdoctoral Scholar,Oregon Health & Science University,4.0,Portland,"Portland, OR 97239 (Homestead area)",,27 days ago,"The Postdoctoral Scholar will be in charge of developing computer vision (image processing, deep learning, features extraction) pipeline for the segmentation…"
625,"Developer, Customer Support Tools (HTML/CSS/JS, Ruby on Rail...",Siemens,4.0,Portland,"Wilsonville, OR 97070",,21 days ago,"Job Title: Developer, Customer Support Tools (HTML/CSS/JS, Ruby on Rails) - SISW - MG 195181.Job Location: USA – OR - Wilsonville or USA - MI - Ann Arbor or…"
626,Data Analytics Manager,PacificSource Health Plans,3.3,Portland,"Portland, OR",,30+ days ago,Position Overview: Lead data analysis processes for PacificSource in support of goals and initiatives identified in our Enterprise Strategic Plan.
627,Software Engineering Manager,Frontdoor,,Portland,"Portland, OR 97240 (Hosford area)",,13 days ago,"They can also take remote measurements, because Streem is capturing depth information during the call.Streem is looking for an Engineering Manager to lead two…"
628,Analytic Consultant 4 - Data,Wells Fargo,3.7,Portland,"Portland, OR",,11 days ago,Check out the top traits we're looking for and see if you have the right mix.Additional related traits listed below.1+ year of Python experience.
629,"Director, Program Management, Analytics",Nike,4.2,Portland,"Beaverton, OR",,30+ days ago,"You will partner with a highly skilled team of product managers, engineers and executive stakeholders to deliver a bold roadmap with multiple dependencies…"
630,Solutions Director (Platform),Ampere Computing,,Portland,"Portland, OR",,30+ days ago,"Like the scientist behind its name, Ampere employees are innovators.We understand the needs of cloud computing and different software requirements."
631,Sr. Technical Writer,NWEA,3.7,Portland,"Portland, OR 97209 (Old Town-Chinatown area)",,30+ days ago,"Preference given to candidates with experience documenting computer adaptive tests, artificial intelligence, machine learning, or similar technologies."
632,Senior Full Stack Engineer,Moogsoft,,Portland,"Portland, OR",,10 days ago,Moogsoft is the creator of Moogsoft AIOps - a next generation approach to IT Operations and Analytics driven by real-time machine learning.
633,Model Validation Manager,Umpqua Bank,3.5,Portland,"Portland, OR 97204 (Downtown area)",,28 days ago,"Advanced understanding of statistical modeling, econometric forecasting, machine learning, data extraction and processing techniques; and demonstrated ability…"
634,Applications Engineering - SISW - MG 186038,Siemens,4.0,Portland,"Wilsonville, OR 97070",,30+ days ago,Knowledge and working experiences with machine learning and big data analytics is a plus.Collaborate with Factory product team on innovative software prototype…
635,Analytic Consultant 4 - Data,Wells Fargo,3.7,Portland,"Portland, OR",,11 days ago,Check out the top traits we're looking for and see if you have the right mix.Additional related traits listed below.1+ year of Python experience.
636,"Director, Program Management, Analytics",Nike,4.2,Portland,"Beaverton, OR",,30+ days ago,"A thorough understanding of qualitative research, data-driven decision making, and a basic understanding of new technologies such as AI and machine learning."
637,Software Engineer for IP Demo GUI - Spring 2020 Intern,Synopsys,4.1,Portland,"Hillsboro, OR 97124",,30+ days ago,"Machine learning and computer vision.To accelerate prototyping, software development and integration of IP into SoCs, Synopsys' IP Accelerated initiative…"
638,Senior BI Analyst,Avamere Health Services,3.2,Portland,"Wilsonville, OR 97070",,30+ days ago,Data Science experience (e.g. machine learning).Commitment and examples of learning new technical skills.Senior BI Analyst: Avamere Health Services.
639,Energy Analyst,DNV GL AS,3.8,Portland,"Portland, OR 97204",,22 days ago,"Identify, recommend, and implement emerging analytic methods such as deep neural network and random forest machine learning models, etc."
640,Energy Analyst,DNV GL AS,3.8,Portland,"Portland, OR 97204",,22 days ago,"DNV GL - Energy is seeking an Energy Analyst to join an extraordinary team as we use energy data, innovative analytic methods, and collaborative, outside-of-the…"
641,Software Engineer | Nike Smart Systems,Nike,4.2,Portland,"Portland, OR",,30+ days ago,We are looking for an experienced Lead Software Engineer with experience building data applications to join our team.8+ years of relevant industry experience.
642,Senior Product Manager - Walmart Brands,The Walmart eCommerce Family of Brands,3.4,Portland,"Portland, OR",,5 days ago,Here's some inside info from business insider on Walmart Brands:We are looking for someone who has experience developing and championing product strategies for…
643,Software Engineer for IP Demo GUI - Spring 2020 Intern,Synopsys,4.1,Portland,"Hillsboro, OR 97124",,30+ days ago,"Machine learning and computer vision.To accelerate prototyping, software development and integration of IP into SoCs, Synopsys' IP Accelerated initiative…"
644,Solutions Architect (multiple locations),"ExtraHop Networks, Inc.",3.5,Portland,"Beaverton, OR",,30+ days ago,ExtraHop’s Solutions Architecture team is very different from many other post-sales services practices—we focus on outcomes and customer success rather than…
645,Data Architect - Data Warehouse & MPP - Nationwide Opportuni...,"Amazon Web Services, Inc.",3.6,Portland,"Portland, OR",,Today,"Bachelor’s degree, or equivalent experience, in Computer Science, Engineering, Mathematics or a related field.This is a customer facing role."
646,Advanced Design Construction and Verification Researcher,Intel,4.1,Portland,"Hillsboro, OR 97124",,30+ days ago,"Develops and applies Computer Aided Design (CAD) software engineering methods, theories and research techniques in the investigation and solution of technical…"
647,"Program Manager, Regulatory Compliance","Amazon Web Services, Inc.",3.6,Portland,"Portland, OR",,30+ days ago,Bachelor’s Degree from an accredited institution.5+ years of experience providing regulatory support for product compliance or similar regulatory matters.
648,Principal Artificial Intelligence Systems Engineer,Skyworks,3.9,Portland,"Beaverton, OR",,8 days ago,"Principal Artificial Intelligence Systems Engineer.As a Principal Artificial Intelligence Systems Engineer, you will be responsible for leading the development…"
649,Senior Software Engineer,"Cylance, Inc.",3.5,Portland,"Portland, OR 97204 (Downtown area)",,19 days ago,"We are seeking a Staff Software Engineer with demonstrable, professional-grade programming experience.To these engineers, systems are code, code is data, data…"
650,Senior Product Manager - Walmart Brands,The Walmart eCommerce Family of Brands,3.4,Portland,"Portland, OR",,5 days ago,"Prefer experience in one or more of the following areas: Big Data, data Quality and Governance, Machine Learning, Visualization, Cloud Security and Privacy."
651,Quantitative Modeler / Data Scientist,Umpqua Bank,3.5,Portland,"Portland, OR 97204 (Downtown area)",,30+ days ago,Develop propensity models using statistical methodologies and machine learning techniques for marketing campaigns.Keeps up to date on regulation changes.
652,Lead Product Owner,Nike,4.2,Portland,"Beaverton, OR",,30+ days ago,"Foundational understanding of machine learning concepts and statistics.As the Lead Product Owner Materials Planning on the DSM Technology team, you'll be…"
653,Data Engineer,"Amazon Web Services, Inc.",3.6,Portland,"Portland, OR",,30+ days ago,"Collaborate with other tech teams to implement advanced analytics algorithms that exploit our rich datasets for statistical analysis, prediction, clustering and…"
654,Advanced Design Construction and Verification Researcher,Intel,4.1,Portland,"Hillsboro, OR 97124",,30+ days ago,"Research domain-specific applications such as machine learning, security, etc.Develops and applies Computer Aided Design (CAD) software engineering methods,…"
655,"Mechanical Engineer, Principal",Ampere Computing,,Portland,"Portland, OR",,5 days ago,"Like the scientist behind its name, Ampere employees are innovators.We understand the needs of cloud computing and different software requirements."
656,Operations Center Support Engineer,FlexIT Inc,,Portland,"Hillsboro, OR 97124",,30+ days ago,"Comfortable leveraging AI and Machine Learning for Predictive Analysis of Failures and Correlation, ideally with Splunk.Comfortable with Linux and Windows."
657,Data Science Graduate Internship,Nike,4.2,Portland,"Beaverton, OR",,30+ days ago,"Core mathematical ability to understand, utilize and innovate on state-of-the art machine learning algorithms and/or statistical modeling."
658,Java Software Engineer,Adpearance,4.0,Portland,"Portland, OR 97209 (Northwest area)",,30+ days ago,"Features include data-driven job execution engine, graphql powered API for searching, and machine learning models for data validation and classification."
659,Systems Architect - Tax,Nike,4.2,Portland,"Beaverton, OR",,30+ days ago,Preferred experience developing AI/machine learning monitored/enhanced predicative financial forecasting models.WHAT YOU BRING TO NIKE.
660,"Mechanical Engineer, Principal",Ampere Computing,,Portland,"Portland, OR",,5 days ago,"Like the scientist behind its name, Ampere employees are innovators.We understand the needs of cloud computing and different software requirements."
661,"CPU Logic Design, Engineer II",Ampere Computing,,Portland,"Portland, OR",,11 days ago,"Like the scientist behind its name, Ampere employees are innovators.We understand the needs of cloud computing and different software requirements."
662,Computer Vision SW Engineer,Intel,4.1,Portland,"Hillsboro, OR 97124",,30+ days ago,"The Next Generation and Standards (NGS) group in Technology, Systems Architecture & Client Group is looking for a Computer Vision SW Engineer for AI/AR/VR…"
663,Design Rule Definition Component Design Engineer,Intel,4.1,Portland,"Hillsboro, OR 97124",,17 days ago,"As a member of the Design Rule Definition Group in Technology Development Group (TMG) /Logic Technology Development (LTD) /Advanced Design (AD), you will be at…"
664,Sr. Design Technologist - Data Visualization & Prototyping,FlexIT Inc,,Portland,"Beaverton, OR 97005 (Central Beaverton area)",,30+ days ago,The Sr. Design Technologist is an exciting new role aimed at speeding up data science innovation.This person will partner with data scientists to help them…
665,Java Software Engineer,Adpearance,4.0,Portland,"Portland, OR 97209 (Pearl District area)",,30+ days ago,We are currently looking to add a Java Developer to our team.This specific position on the Research & Development team focuses on data collection systems for…
